{
  "$schema": "https://json-schema.org/draft/2020-12/schema",
  "$id": "https://phaser-platformer.local/level.schema.json",
  "title": "方块跑酷关卡",
  "type": "object",
  "additionalProperties": false,
  "required": ["id", "name", "speed", "duration", "palette", "obstacles", "stars", "checkpoints"],
  "properties": {
    "id": { "type": "string", "pattern": "^level-[1-9][0-9]*$" },
    "name": { "type": "string", "minLength": 1 },
    "speed": { "type": "number", "exclusiveMinimum": 0, "maximum": 520 },
    "duration": { "type": "number", "minimum": 40, "maximum": 90 },
    "palette": { "type": "string", "minLength": 1 },
    "obstacles": {
      "type": "array",
      "items": { "$ref": "#/$defs/obstacle" }
    },
    "stars": {
      "type": "array",
      "minItems": 3,
      "maxItems": 3,
      "items": { "$ref": "#/$defs/star" }
    },
    "checkpoints": {
      "type": "array",
      "items": { "type": "number", "minimum": 0 }
    },
    "powerups": {
      "type": "array",
      "items": { "$ref": "#/$defs/powerup" }
    },
    "routes": {
      "type": "array",
      "items": { "$ref": "#/$defs/route" }
    }
  },
  "$defs": {
    "obstacle": {
      "type": "object",
      "additionalProperties": false,
      "required": ["t", "type"],
      "properties": {
        "t": { "type": "number", "minimum": 0 },
        "type": { "enum": ["spike", "block", "overhead", "crumble", "gate", "flip"] },
        "count": { "type": "integer", "minimum": 1, "maximum": 6 },
        "anchor": { "enum": ["floor", "ceiling"] },
        "gap": { "type": "number", "minimum": 48, "maximum": 120 },
        "span": { "type": "number", "exclusiveMinimum": 0, "maximum": 8 },
        "delay": { "type": "number", "exclusiveMinimum": 0, "maximum": 3 },
        "period": { "type": "number", "exclusiveMinimum": 0.2, "maximum": 6 },
        "open": { "type": "number", "exclusiveMinimum": 0, "maximum": 6 },
        "phase": { "type": "number" }
      },
      "allOf": [
        {
          "if": { "properties": { "type": { "const": "crumble" } } },
          "then": { "required": ["span", "delay"] }
        },
        {
          "if": { "properties": { "type": { "const": "gate" } } },
          "then": { "required": ["period", "open"] }
        },
        {
          "if": { "properties": { "type": { "const": "flip" } } },
          "then": { "required": ["span"] }
        }
      ]
    },
    "powerup": {
      "type": "object",
      "additionalProperties": false,
      "required": ["t", "type"],
      "properties": {
        "t": { "type": "number", "minimum": 0 },
        "type": { "enum": ["double", "armor", "plane"] },
        "lift": { "type": "number", "minimum": 0, "maximum": 340 },
        "dx": { "type": "number", "minimum": -400, "maximum": 400 }
      }
    },
    "star": {
      "type": "object",
      "additionalProperties": false,
      "required": ["t"],
      "properties": {
        "t": { "type": "number", "minimum": 0 },
        "lift": { "type": "number", "minimum": 0, "maximum": 340 },
        "dx": { "type": "number" }
      }
    },
    "route": {
      "type": "object",
      "additionalProperties": false,
      "required": ["t", "span", "h"],
      "properties": {
        "t": { "type": "number", "minimum": 0 },
        "span": { "type": "number", "minimum": 2, "maximum": 12 },
        "h": { "type": "number", "minimum": 160, "maximum": 240 },
        "layer": { "const": 2 },
        "reward": { "enum": ["star", "safe", "shortcut"] },
        "step": { "$ref": "#/$defs/step" },
        "high": { "$ref": "#/$defs/high" },
        "obstacles": {
          "type": "array",
          "items": { "$ref": "#/$defs/routeObstacle" }
        }
      }
    },
    "step": {
      "type": "object",
      "additionalProperties": false,
      "required": ["h", "span"],
      "properties": {
        "h": { "type": "number", "minimum": 48, "maximum": 130 },
        "span": { "type": "number", "minimum": 0.4, "maximum": 4 },
        "lead": { "type": "number", "minimum": 0, "maximum": 3 }
      }
    },
    "high": {
      "type": "object",
      "additionalProperties": false,
      "required": ["h", "span"],
      "properties": {
        "h": { "type": "number", "minimum": 220, "maximum": 320 },
        "span": { "type": "number", "minimum": 1.2, "maximum": 8 },
        "lead": { "type": "number", "minimum": 0, "maximum": 6 },
        "reward": { "enum": ["star", "safe", "shortcut"] },
        "obstacles": {
          "type": "array",
          "items": { "$ref": "#/$defs/routeObstacle" }
        }
      }
    },
    "routeObstacle": {
      "type": "object",
      "additionalProperties": false,
      "required": ["t", "type"],
      "properties": {
        "t": { "type": "number", "minimum": 0 },
        "type": { "enum": ["spike", "block", "overhead", "gate"] },
        "count": { "type": "integer", "minimum": 1, "maximum": 6 },
        "gap": { "type": "number", "minimum": 48, "maximum": 120 },
        "period": { "type": "number", "exclusiveMinimum": 0.2, "maximum": 6 },
        "open": { "type": "number", "exclusiveMinimum": 0, "maximum": 6 },
        "phase": { "type": "number" }
      }
    }
  }
}
