{
  "id": "level-2",
  "name": "紫晶连跳",
  "speed": 324,
  "duration": 56.93,
  "palette": "violet",
  "obstacles": [
    {
      "t": 2.15,
      "type": "spike",
      "count": 3
    },
    {
      "t": 3.65,
      "type": "spike",
      "count": 3
    },
    {
      "t": 5.15,
      "type": "block"
    },
    {
      "t": 5.36,
      "type": "spike",
      "count": 1
    },
    {
      "t": 5.55,
      "type": "spike",
      "count": 1
    },
    {
      "t": 5.74,
      "type": "spike",
      "count": 1
    },
    {
      "t": 6.05,
      "type": "spike",
      "count": 1
    },
    {
      "t": 8.68,
      "type": "overhead",
      "gap": 58
    },
    {
      "t": 9.23,
      "type": "spike",
      "count": 3
    },
    {
      "t": 10.73,
      "type": "overhead",
      "gap": 58
    },
    {
      "t": 10.94,
      "type": "spike",
      "count": 1
    },
    {
      "t": 13.17,
      "type": "spike",
      "count": 1
    },
    {
      "t": 14.69,
      "type": "spike",
      "count": 3
    },
    {
      "t": 16.19,
      "type": "block"
    },
    {
      "t": 17.69,
      "type": "overhead",
      "gap": 58
    },
    {
      "t": 20.47,
      "type": "spike",
      "count": 3
    },
    {
      "t": 21.97,
      "type": "overhead",
      "gap": 58
    },
    {
      "t": 22.75,
      "type": "spike",
      "count": 3
    },
    {
      "t": 23.86,
      "type": "spike",
      "count": 3
    },
    {
      "t": 24.27,
      "type": "spike",
      "count": 1
    },
    {
      "t": 24.46,
      "type": "spike",
      "count": 1
    },
    {
      "t": 27.38,
      "type": "block"
    },
    {
      "t": 28.88,
      "type": "overhead",
      "gap": 58
    },
    {
      "t": 29.6,
      "type": "spike",
      "count": 3
    },
    {
      "t": 30.01,
      "type": "spike",
      "count": 1
    },
    {
      "t": 30.2,
      "type": "spike",
      "count": 1
    },
    {
      "t": 30.51,
      "type": "spike",
      "count": 1
    },
    {
      "t": 33.13,
      "type": "overhead",
      "gap": 58
    },
    {
      "t": 33.91,
      "type": "spike",
      "count": 3
    },
    {
      "t": 35.02,
      "type": "spike",
      "count": 2
    },
    {
      "t": 36.52,
      "type": "block"
    },
    {
      "t": 36.73,
      "type": "spike",
      "count": 1
    },
    {
      "t": 36.92,
      "type": "spike",
      "count": 1
    },
    {
      "t": 37.11,
      "type": "spike",
      "count": 1
    },
    {
      "t": 37.42,
      "type": "spike",
      "count": 1
    },
    {
      "t": 40.04,
      "type": "overhead",
      "gap": 58
    },
    {
      "t": 40.76,
      "type": "spike",
      "count": 2
    },
    {
      "t": 42.26,
      "type": "overhead",
      "gap": 58
    },
    {
      "t": 43.04,
      "type": "spike",
      "count": 2
    },
    {
      "t": 43.34,
      "type": "spike",
      "count": 1
    },
    {
      "t": 43.53,
      "type": "spike",
      "count": 1
    },
    {
      "t": 46.45,
      "type": "spike",
      "count": 2
    },
    {
      "t": 47.95,
      "type": "block"
    },
    {
      "t": 49.45,
      "type": "overhead",
      "gap": 58
    },
    {
      "t": 52.23,
      "type": "spike",
      "count": 2
    },
    {
      "t": 53.73,
      "type": "overhead",
      "gap": 58
    },
    {
      "t": 54.51,
      "type": "spike",
      "count": 2
    },
    {
      "t": 55.63,
      "type": "spike",
      "count": 2
    }
  ],
  "stars": [
    {
      "t": 1.25,
      "lift": 0
    },
    {
      "t": 15.05,
      "lift": 200
    },
    {
      "t": 35.66,
      "lift": 0
    }
  ],
  "powerups": [
    { "t": 25.975, "type": "armor" }
  ],
  "checkpoints": [
    10,
    21.32,
    32,
    43.96
  ],
  "routes": [
    {
      "t": 12.2,
      "span": 4.6,
      "h": 200,
      "layer": 2,
      "reward": "star",
      "step": {
        "h": 84,
        "span": 1.55,
        "lead": 0.85
      },
      "obstacles": [
        {
          "t": 13.9,
          "type": "block"
        }
      ]
    }
  ]
}
