{
  "id": "level-3",
  "name": "靛色窄缝",
  "speed": 330,
  "duration": 55.6,
  "palette": "indigo",
  "obstacles": [
    {
      "t": 2.15,
      "type": "block"
    },
    {
      "t": 3.65,
      "type": "overhead",
      "gap": 58
    },
    {
      "t": 4.2,
      "type": "spike",
      "count": 3
    },
    {
      "t": 6.1,
      "type": "spike",
      "count": 3
    },
    {
      "t": 7.83,
      "type": "overhead",
      "gap": 58
    },
    {
      "t": 8.38,
      "type": "spike",
      "count": 3
    },
    {
      "t": 9.68,
      "type": "spike",
      "count": 3
    },
    {
      "t": 10.09,
      "type": "spike",
      "count": 1
    },
    {
      "t": 10.28,
      "type": "spike",
      "count": 1
    },
    {
      "t": 10.59,
      "type": "spike",
      "count": 1
    },
    {
      "t": 10.78,
      "type": "spike",
      "count": 1
    },
    {
      "t": 13.13,
      "type": "spike",
      "count": 1
    },
    {
      "t": 14.63,
      "type": "block"
    },
    {
      "t": 16.13,
      "type": "overhead",
      "gap": 58
    },
    {
      "t": 16.34,
      "type": "spike",
      "count": 1
    },
    {
      "t": 17.73,
      "type": "spike",
      "count": 1
    },
    {
      "t": 17.92,
      "type": "spike",
      "count": 1
    },
    {
      "t": 18.11,
      "type": "spike",
      "count": 1
    },
    {
      "t": 20.3,
      "type": "overhead",
      "gap": 58
    },
    {
      "t": 21.08,
      "type": "spike",
      "count": 3
    },
    {
      "t": 22.16,
      "type": "spike",
      "count": 3
    },
    {
      "t": 23.66,
      "type": "spike",
      "count": 2
    },
    {
      "t": 25.39,
      "type": "spike",
      "count": 1
    },
    {
      "t": 27.12,
      "type": "block"
    },
    {
      "t": 28.62,
      "type": "overhead",
      "gap": 58
    },
    {
      "t": 29.34,
      "type": "spike",
      "count": 2
    },
    {
      "t": 29.64,
      "type": "spike",
      "count": 1
    },
    {
      "t": 29.83,
      "type": "spike",
      "count": 1
    },
    {
      "t": 30.14,
      "type": "spike",
      "count": 1
    },
    {
      "t": 30.33,
      "type": "spike",
      "count": 1
    },
    {
      "t": 30.52,
      "type": "spike",
      "count": 1
    },
    {
      "t": 32.79,
      "type": "overhead",
      "gap": 58
    },
    {
      "t": 33.57,
      "type": "spike",
      "count": 2
    },
    {
      "t": 34.65,
      "type": "spike",
      "count": 1
    },
    {
      "t": 36.15,
      "type": "spike",
      "count": 2
    },
    {
      "t": 37.88,
      "type": "spike",
      "count": 2
    },
    {
      "t": 39.61,
      "type": "block"
    },
    {
      "t": 41.11,
      "type": "overhead",
      "gap": 58
    },
    {
      "t": 41.83,
      "type": "spike",
      "count": 2
    },
    {
      "t": 43.56,
      "type": "spike",
      "count": 1
    },
    {
      "t": 45.29,
      "type": "overhead",
      "gap": 58
    },
    {
      "t": 46.07,
      "type": "spike",
      "count": 2
    },
    {
      "t": 47.14,
      "type": "spike",
      "count": 1
    },
    {
      "t": 48.64,
      "type": "spike",
      "count": 2
    },
    {
      "t": 48.94,
      "type": "spike",
      "count": 1
    },
    {
      "t": 49.13,
      "type": "spike",
      "count": 1
    },
    {
      "t": 49.44,
      "type": "spike",
      "count": 1
    },
    {
      "t": 49.63,
      "type": "spike",
      "count": 1
    },
    {
      "t": 49.82,
      "type": "spike",
      "count": 1
    },
    {
      "t": 50.01,
      "type": "spike",
      "count": 1
    },
    {
      "t": 52.09,
      "type": "block"
    },
    {
      "t": 53.59,
      "type": "overhead",
      "gap": 58
    },
    {
      "t": 54.31,
      "type": "spike",
      "count": 2
    }
  ],
  "stars": [
    {
      "t": 1.25,
      "lift": 0
    },
    {
      "t": 15.05,
      "lift": 200
    },
    {
      "t": 35.19,
      "lift": 0
    }
  ],
  "checkpoints": [
    13.84,
    22.92,
    32,
    43
  ],
  "routes": [
    {
      "t": 12.2,
      "span": 4.6,
      "h": 200,
      "layer": 2,
      "reward": "star",
      "step": {
        "h": 84,
        "span": 1.55,
        "lead": 0.85
      },
      "obstacles": [
        {
          "t": 13.9,
          "type": "overhead",
          "gap": 58
        }
      ]
    }
  ]
}
