{
  "id": "level-1",
  "name": "紫色冲刺",
  "speed": 318,
  "duration": 56.93,
  "palette": "magenta",
  "obstacles": [
    {
      "t": 2.15,
      "type": "overhead",
      "gap": 58
    },
    {
      "t": 2.7,
      "type": "spike",
      "count": 3
    },
    {
      "t": 4.2,
      "type": "spike",
      "count": 3
    },
    {
      "t": 4.62,
      "type": "spike",
      "count": 1
    },
    {
      "t": 7.8,
      "type": "block"
    },
    {
      "t": 9.3,
      "type": "overhead",
      "gap": 58
    },
    {
      "t": 9.85,
      "type": "spike",
      "count": 3
    },
    {
      "t": 10.27,
      "type": "spike",
      "count": 1
    },
    {
      "t": 13.45,
      "type": "spike",
      "count": 3
    },
    {
      "t": 14.95,
      "type": "block"
    },
    {
      "t": 16.45,
      "type": "overhead",
      "gap": 58
    },
    {
      "t": 19.26,
      "type": "spike",
      "count": 3
    },
    {
      "t": 20.76,
      "type": "spike",
      "count": 3
    },
    {
      "t": 22.26,
      "type": "block"
    },
    {
      "t": 22.47,
      "type": "spike",
      "count": 1
    },
    {
      "t": 22.66,
      "type": "spike",
      "count": 1
    },
    {
      "t": 22.85,
      "type": "spike",
      "count": 1
    },
    {
      "t": 25.86,
      "type": "overhead",
      "gap": 58
    },
    {
      "t": 26.58,
      "type": "spike",
      "count": 3
    },
    {
      "t": 28.08,
      "type": "spike",
      "count": 2
    },
    {
      "t": 28.39,
      "type": "spike",
      "count": 1
    },
    {
      "t": 28.58,
      "type": "spike",
      "count": 1
    },
    {
      "t": 31.68,
      "type": "block"
    },
    {
      "t": 33.18,
      "type": "overhead",
      "gap": 58
    },
    {
      "t": 33.9,
      "type": "spike",
      "count": 1
    },
    {
      "t": 34.09,
      "type": "spike",
      "count": 1
    },
    {
      "t": 34.28,
      "type": "spike",
      "count": 1
    },
    {
      "t": 34.47,
      "type": "spike",
      "count": 1
    },
    {
      "t": 37.5,
      "type": "spike",
      "count": 2
    },
    {
      "t": 39,
      "type": "block"
    },
    {
      "t": 40.5,
      "type": "overhead",
      "gap": 58
    },
    {
      "t": 43.31,
      "type": "spike",
      "count": 1
    },
    {
      "t": 44.81,
      "type": "spike",
      "count": 2
    },
    {
      "t": 46.31,
      "type": "block"
    },
    {
      "t": 46.52,
      "type": "spike",
      "count": 1
    },
    {
      "t": 46.71,
      "type": "spike",
      "count": 1
    },
    {
      "t": 49.91,
      "type": "overhead",
      "gap": 58
    },
    {
      "t": 50.63,
      "type": "spike",
      "count": 1
    },
    {
      "t": 52.13,
      "type": "spike",
      "count": 2
    },
    {
      "t": 52.44,
      "type": "spike",
      "count": 1
    },
    {
      "t": 52.63,
      "type": "spike",
      "count": 1
    },
    {
      "t": 55.73,
      "type": "block"
    }
  ],
  "stars": [
    {
      "t": 1.25,
      "lift": 0
    },
    {
      "t": 15.05,
      "lift": 200
    },
    {
      "t": 35.3,
      "lift": 0
    }
  ],
  "checkpoints": [
    10.96,
    21.64,
    32.32,
    43
  ],
  "routes": [
    {
      "t": 12.2,
      "span": 4.6,
      "h": 200,
      "layer": 2,
      "reward": "star",
      "step": {
        "h": 84,
        "span": 1.55,
        "lead": 0.85
      },
      "obstacles": [
        {
          "t": 13.9,
          "type": "overhead",
          "gap": 58
        }
      ]
    }
  ]
}
