{
  "id": "level-14",
  "name": "坠门交织",
  "speed": 396,
  "duration": 52.84,
  "palette": "gold",
  "obstacles": [
    {
      "t": 2.15,
      "type": "crumble",
      "span": 1.18,
      "delay": 0.52
    },
    {
      "t": 3.01,
      "type": "spike",
      "count": 4
    },
    {
      "t": 3.88,
      "type": "gate",
      "period": 1.4,
      "open": 0.62,
      "phase": -0.03
    },
    {
      "t": 4.07,
      "type": "spike",
      "count": 1
    },
    {
      "t": 4.24,
      "type": "spike",
      "count": 1
    },
    {
      "t": 4.9,
      "type": "flip",
      "span": 2.35
    },
    {
      "t": 6.55,
      "type": "spike",
      "count": 4
    },
    {
      "t": 8.1,
      "type": "flip",
      "span": 3.55
    },
    {
      "t": 9.3,
      "type": "spike",
      "anchor": "ceiling",
      "count": 1
    },
    {
      "t": 9.41,
      "type": "overhead",
      "gap": 58
    },
    {
      "t": 10.45,
      "type": "spike",
      "anchor": "ceiling",
      "count": 1
    },
    {
      "t": 11.39,
      "type": "spike",
      "count": 4
    },
    {
      "t": 12.31,
      "type": "spike",
      "count": 2
    },
    {
      "t": 12.57,
      "type": "spike",
      "count": 2
    },
    {
      "t": 14.75,
      "type": "spike",
      "count": 2
    },
    {
      "t": 14.91,
      "type": "spike",
      "count": 4
    },
    {
      "t": 15.35,
      "type": "spike",
      "count": 1
    },
    {
      "t": 15.93,
      "type": "block"
    },
    {
      "t": 16.12,
      "type": "spike",
      "count": 2
    },
    {
      "t": 16.38,
      "type": "spike",
      "count": 2
    },
    {
      "t": 16.76,
      "type": "spike",
      "count": 2
    },
    {
      "t": 17.02,
      "type": "spike",
      "count": 2
    },
    {
      "t": 17.28,
      "type": "spike",
      "count": 2
    },
    {
      "t": 17.66,
      "type": "spike",
      "count": 2
    },
    {
      "t": 19,
      "type": "spike",
      "count": 2
    },
    {
      "t": 19.26,
      "type": "spike",
      "count": 1
    },
    {
      "t": 19.89,
      "type": "spike",
      "count": 4
    },
    {
      "t": 20.33,
      "type": "spike",
      "count": 1
    },
    {
      "t": 20.87,
      "type": "gate",
      "period": 1.4,
      "open": 0.62,
      "phase": 0.95
    },
    {
      "t": 21.06,
      "type": "spike",
      "count": 1
    },
    {
      "t": 21.23,
      "type": "spike",
      "count": 1
    },
    {
      "t": 21.89,
      "type": "overhead",
      "gap": 58
    },
    {
      "t": 22.08,
      "type": "spike",
      "count": 1
    },
    {
      "t": 22.75,
      "type": "gate",
      "period": 1.4,
      "open": 0.62,
      "phase": 0.47
    },
    {
      "t": 22.94,
      "type": "spike",
      "count": 1
    },
    {
      "t": 23.11,
      "type": "spike",
      "count": 1
    },
    {
      "t": 23.77,
      "type": "overhead",
      "gap": 58
    },
    {
      "t": 23.96,
      "type": "spike",
      "count": 1
    },
    {
      "t": 24.55,
      "type": "spike",
      "count": 4
    },
    {
      "t": 24.99,
      "type": "spike",
      "count": 1
    },
    {
      "t": 25.57,
      "type": "spike",
      "count": 3
    },
    {
      "t": 25.92,
      "type": "spike",
      "count": 2
    },
    {
      "t": 28.35,
      "type": "spike",
      "count": 2
    },
    {
      "t": 28.61,
      "type": "spike",
      "count": 1
    },
    {
      "t": 29.23,
      "type": "spike",
      "count": 1
    },
    {
      "t": 29.4,
      "type": "spike",
      "count": 1
    },
    {
      "t": 29.57,
      "type": "spike",
      "count": 1
    },
    {
      "t": 30.1,
      "type": "block"
    },
    {
      "t": 30.29,
      "type": "spike",
      "count": 1
    },
    {
      "t": 30.46,
      "type": "spike",
      "count": 1
    },
    {
      "t": 31.12,
      "type": "overhead",
      "gap": 58
    },
    {
      "t": 31.31,
      "type": "spike",
      "count": 2
    },
    {
      "t": 32.65,
      "type": "spike",
      "count": 2
    },
    {
      "t": 32.86,
      "type": "overhead",
      "gap": 58
    },
    {
      "t": 33.05,
      "type": "spike",
      "count": 1
    },
    {
      "t": 33.64,
      "type": "spike",
      "count": 3
    },
    {
      "t": 33.99,
      "type": "spike",
      "count": 1
    },
    {
      "t": 34.66,
      "type": "spike",
      "count": 3
    },
    {
      "t": 35.01,
      "type": "spike",
      "count": 1
    },
    {
      "t": 35.54,
      "type": "spike",
      "count": 2
    },
    {
      "t": 35.8,
      "type": "spike",
      "count": 1
    },
    {
      "t": 36.42,
      "type": "spike",
      "count": 1
    },
    {
      "t": 36.59,
      "type": "spike",
      "count": 1
    },
    {
      "t": 36.76,
      "type": "spike",
      "count": 1
    },
    {
      "t": 37.3,
      "type": "spike",
      "count": 2
    },
    {
      "t": 37.56,
      "type": "spike",
      "count": 1
    },
    {
      "t": 38.17,
      "type": "block"
    },
    {
      "t": 38.36,
      "type": "spike",
      "count": 2
    },
    {
      "t": 38.62,
      "type": "spike",
      "count": 2
    },
    {
      "t": 39,
      "type": "spike",
      "count": 2
    },
    {
      "t": 39.26,
      "type": "spike",
      "count": 1
    },
    {
      "t": 39.43,
      "type": "spike",
      "count": 1
    },
    {
      "t": 40.06,
      "type": "spike",
      "count": 1
    },
    {
      "t": 42.39,
      "type": "spike",
      "count": 2
    },
    {
      "t": 42.8,
      "type": "gate",
      "period": 1.4,
      "open": 0.62,
      "phase": 0.02
    },
    {
      "t": 42.99,
      "type": "spike",
      "count": 1
    },
    {
      "t": 43.16,
      "type": "spike",
      "count": 1
    },
    {
      "t": 43.82,
      "type": "overhead",
      "gap": 58
    },
    {
      "t": 44.01,
      "type": "spike",
      "count": 1
    },
    {
      "t": 44.6,
      "type": "spike",
      "count": 3
    },
    {
      "t": 44.95,
      "type": "spike",
      "count": 2
    },
    {
      "t": 45.33,
      "type": "spike",
      "count": 2
    },
    {
      "t": 46.67,
      "type": "spike",
      "count": 2
    },
    {
      "t": 46.95,
      "type": "spike",
      "count": 2
    },
    {
      "t": 47.21,
      "type": "spike",
      "count": 1
    },
    {
      "t": 47.8,
      "type": "spike",
      "count": 1
    },
    {
      "t": 47.97,
      "type": "spike",
      "count": 1
    },
    {
      "t": 48.14,
      "type": "spike",
      "count": 1
    },
    {
      "t": 48.82,
      "type": "spike",
      "count": 2
    },
    {
      "t": 49.08,
      "type": "spike",
      "count": 1
    },
    {
      "t": 49.25,
      "type": "spike",
      "count": 1
    },
    {
      "t": 49.84,
      "type": "block"
    },
    {
      "t": 50.03,
      "type": "spike",
      "count": 1
    },
    {
      "t": 50.2,
      "type": "spike",
      "count": 1
    },
    {
      "t": 50.86,
      "type": "overhead",
      "gap": 58
    },
    {
      "t": 51.05,
      "type": "spike",
      "count": 1
    },
    {
      "t": 51.58,
      "type": "spike",
      "count": 2
    }
  ],
  "stars": [
    {
      "t": 1.25,
      "lift": 0
    },
    {
      "t": 16.5,
      "lift": 200
    },
    {
      "t": 43.79,
      "lift": 200
    }
  ],
  "powerups": [
    { "t": 7.676, "type": "armor" },
    { "t": 32.071, "type": "plane" },
    { "t": 46.091, "type": "double" }
  ],
  "checkpoints": [],
  "routes": [
    {
      "t": 13.8,
      "span": 4.35,
      "h": 200,
      "layer": 2,
      "reward": "star",
      "step": {
        "h": 84,
        "span": 1.55,
        "lead": 0.85
      },
      "obstacles": [
        {
          "t": 15.45,
          "type": "overhead",
          "gap": 58
        }
      ]
    },
    {
      "t": 27.4,
      "span": 4.35,
      "h": 200,
      "layer": 2,
      "reward": "safe",
      "step": {
        "h": 84,
        "span": 1.55,
        "lead": 0.85
      },
      "obstacles": []
    },
    {
      "t": 41.4,
      "span": 4.35,
      "h": 200,
      "layer": 2,
      "reward": "shortcut",
      "step": {
        "h": 84,
        "span": 1.55,
        "lead": 0.85
      },
      "obstacles": []
    }
  ]
}
