{
  "id": "level-18",
  "name": "无缝连跳",
  "speed": 420,
  "duration": 59.37,
  "palette": "emerald",
  "obstacles": [
    {
      "t": 2.15,
      "type": "crumble",
      "span": 1.18,
      "delay": 0.52
    },
    {
      "t": 3.65,
      "type": "gate",
      "period": 1.4,
      "open": 0.62,
      "phase": 0.2
    },
    {
      "t": 4.7,
      "type": "flip",
      "span": 2.35
    },
    {
      "t": 6.35,
      "type": "spike",
      "count": 4
    },
    {
      "t": 7.9,
      "type": "flip",
      "span": 4.15
    },
    {
      "t": 8.95,
      "type": "spike",
      "count": 4
    },
    {
      "t": 9.1,
      "type": "spike",
      "anchor": "ceiling",
      "count": 1
    },
    {
      "t": 9.45,
      "type": "spike",
      "count": 4
    },
    {
      "t": 10,
      "type": "spike",
      "count": 4
    },
    {
      "t": 10.25,
      "type": "spike",
      "anchor": "ceiling",
      "count": 2
    },
    {
      "t": 11.15,
      "type": "spike",
      "anchor": "ceiling",
      "count": 1
    },
    {
      "t": 11.7,
      "type": "spike",
      "count": 4
    },
    {
      "t": 12.25,
      "type": "spike",
      "count": 4
    },
    {
      "t": 13.3,
      "type": "block"
    },
    {
      "t": 14.35,
      "type": "overhead",
      "gap": 58
    },
    {
      "t": 14.9,
      "type": "spike",
      "count": 4
    },
    {
      "t": 15.95,
      "type": "overhead",
      "gap": 58
    },
    {
      "t": 16.5,
      "type": "spike",
      "count": 4
    },
    {
      "t": 17.47,
      "type": "spike",
      "count": 4
    },
    {
      "t": 18.97,
      "type": "spike",
      "count": 4
    },
    {
      "t": 20.47,
      "type": "block"
    },
    {
      "t": 21.52,
      "type": "crumble",
      "span": 1.18,
      "delay": 0.52
    },
    {
      "t": 23.02,
      "type": "gate",
      "period": 1.4,
      "open": 0.62,
      "phase": 0.48
    },
    {
      "t": 24.07,
      "type": "overhead",
      "gap": 58
    },
    {
      "t": 24.93,
      "type": "gate",
      "period": 1.4,
      "open": 0.62,
      "phase": -0.03
    },
    {
      "t": 25.89,
      "type": "overhead",
      "gap": 58
    },
    {
      "t": 26.67,
      "type": "spike",
      "count": 4
    },
    {
      "t": 27.64,
      "type": "crumble",
      "span": 1.18,
      "delay": 0.52
    },
    {
      "t": 28.61,
      "type": "spike",
      "count": 3
    },
    {
      "t": 29.58,
      "type": "spike",
      "count": 4
    },
    {
      "t": 31.08,
      "type": "overhead",
      "gap": 58
    },
    {
      "t": 31.94,
      "type": "gate",
      "period": 1.4,
      "open": 0.62,
      "phase": -0.04
    },
    {
      "t": 32.9,
      "type": "flip",
      "span": 4.15
    },
    {
      "t": 33.95,
      "type": "block"
    },
    {
      "t": 34.1,
      "type": "spike",
      "anchor": "ceiling",
      "count": 1
    },
    {
      "t": 34.45,
      "type": "spike",
      "count": 4
    },
    {
      "t": 35,
      "type": "overhead",
      "gap": 58
    },
    {
      "t": 35.25,
      "type": "spike",
      "anchor": "ceiling",
      "count": 2
    },
    {
      "t": 35.72,
      "type": "spike",
      "count": 4
    },
    {
      "t": 36.15,
      "type": "spike",
      "anchor": "ceiling",
      "count": 1
    },
    {
      "t": 36.77,
      "type": "overhead",
      "gap": 58
    },
    {
      "t": 37.55,
      "type": "spike",
      "count": 4
    },
    {
      "t": 39.05,
      "type": "spike",
      "count": 3
    },
    {
      "t": 40.55,
      "type": "spike",
      "count": 3
    },
    {
      "t": 41.6,
      "type": "block"
    },
    {
      "t": 42.65,
      "type": "crumble",
      "span": 1.18,
      "delay": 0.52
    },
    {
      "t": 44.15,
      "type": "gate",
      "period": 1.4,
      "open": 0.62,
      "phase": 0.35
    },
    {
      "t": 45.2,
      "type": "overhead",
      "gap": 58
    },
    {
      "t": 46.06,
      "type": "gate",
      "period": 1.4,
      "open": 0.62,
      "phase": -0.16
    },
    {
      "t": 47.03,
      "type": "overhead",
      "gap": 58
    },
    {
      "t": 47.81,
      "type": "spike",
      "count": 3
    },
    {
      "t": 49.31,
      "type": "spike",
      "count": 1
    },
    {
      "t": 50.81,
      "type": "crumble",
      "span": 1.18,
      "delay": 0.52
    },
    {
      "t": 52.31,
      "type": "overhead",
      "gap": 58
    },
    {
      "t": 53.17,
      "type": "gate",
      "period": 1.4,
      "open": 0.62,
      "phase": -0.27
    },
    {
      "t": 54.14,
      "type": "flip",
      "span": 4.15
    },
    {
      "t": 55.34,
      "type": "spike",
      "anchor": "ceiling",
      "count": 1
    },
    {
      "t": 55.69,
      "type": "spike",
      "count": 2
    },
    {
      "t": 56.49,
      "type": "spike",
      "anchor": "ceiling",
      "count": 2
    },
    {
      "t": 57.39,
      "type": "spike",
      "anchor": "ceiling",
      "count": 1
    }
  ],
  "stars": [
    {
      "t": 1.6,
      "lift": 0
    },
    {
      "t": 30.35,
      "lift": 0
    },
    {
      "t": 48.6,
      "lift": 0
    }
  ],
  "checkpoints": [
    38.6,
    48.6
  ]
}
