{
  "id": "level-15",
  "name": "反转尖刺",
  "speed": 402,
  "duration": 64,
  "palette": "sea",
  "obstacles": [
    {
      "t": 2.15,
      "type": "crumble",
      "span": 1.18,
      "delay": 0.52
    },
    {
      "t": 3.01,
      "type": "spike",
      "count": 4
    },
    {
      "t": 3.88,
      "type": "gate",
      "period": 1.4,
      "open": 0.62,
      "phase": -0.03
    },
    {
      "t": 4.9,
      "type": "flip",
      "span": 2.35
    },
    {
      "t": 6.55,
      "type": "spike",
      "count": 4
    },
    {
      "t": 8.1,
      "type": "flip",
      "span": 3.55
    },
    {
      "t": 9.3,
      "type": "spike",
      "anchor": "ceiling",
      "count": 1
    },
    {
      "t": 9.39,
      "type": "overhead",
      "gap": 58
    },
    {
      "t": 9.65,
      "type": "spike",
      "count": 4
    },
    {
      "t": 10.25,
      "type": "gate",
      "period": 1.4,
      "open": 0.62,
      "phase": 0.6
    },
    {
      "t": 10.45,
      "type": "spike",
      "anchor": "ceiling",
      "count": 1
    },
    {
      "t": 11.43,
      "type": "spike",
      "count": 4
    },
    {
      "t": 12.3,
      "type": "spike",
      "count": 4
    },
    {
      "t": 13.17,
      "type": "spike",
      "count": 4
    },
    {
      "t": 14.04,
      "type": "spike",
      "count": 4
    },
    {
      "t": 14.91,
      "type": "spike",
      "count": 4
    },
    {
      "t": 15.93,
      "type": "block"
    },
    {
      "t": 16.95,
      "type": "overhead",
      "gap": 58
    },
    {
      "t": 17.67,
      "type": "spike",
      "count": 3
    },
    {
      "t": 18.69,
      "type": "overhead",
      "gap": 58
    },
    {
      "t": 19.47,
      "type": "spike",
      "count": 3
    },
    {
      "t": 19.91,
      "type": "spike",
      "count": 2
    },
    {
      "t": 20.66,
      "type": "spike",
      "count": 3
    },
    {
      "t": 21.53,
      "type": "spike",
      "count": 1
    },
    {
      "t": 22.4,
      "type": "spike",
      "count": 1
    },
    {
      "t": 23.27,
      "type": "spike",
      "count": 2
    },
    {
      "t": 24.14,
      "type": "block"
    },
    {
      "t": 25.16,
      "type": "crumble",
      "span": 1.18,
      "delay": 0.52
    },
    {
      "t": 26.03,
      "type": "spike",
      "count": 2
    },
    {
      "t": 26.89,
      "type": "gate",
      "period": 1.4,
      "open": 0.62,
      "phase": 0.76
    },
    {
      "t": 27.91,
      "type": "overhead",
      "gap": 58
    },
    {
      "t": 28.77,
      "type": "gate",
      "period": 1.4,
      "open": 0.62,
      "phase": 0.28
    },
    {
      "t": 29.96,
      "type": "overhead",
      "gap": 58
    },
    {
      "t": 30.74,
      "type": "spike",
      "count": 3
    },
    {
      "t": 31.18,
      "type": "spike",
      "count": 2
    },
    {
      "t": 31.92,
      "type": "crumble",
      "span": 1.18,
      "delay": 0.52
    },
    {
      "t": 32.9,
      "type": "spike",
      "count": 2
    },
    {
      "t": 33.88,
      "type": "spike",
      "count": 1
    },
    {
      "t": 34.86,
      "type": "spike",
      "count": 1
    },
    {
      "t": 35.84,
      "type": "overhead",
      "gap": 58
    },
    {
      "t": 36.7,
      "type": "gate",
      "period": 1.4,
      "open": 0.62,
      "phase": 0.75
    },
    {
      "t": 37.89,
      "type": "spike",
      "count": 1
    },
    {
      "t": 38.91,
      "type": "spike",
      "count": 2
    },
    {
      "t": 39.93,
      "type": "block"
    },
    {
      "t": 40.95,
      "type": "overhead",
      "gap": 58
    },
    {
      "t": 41.67,
      "type": "spike",
      "count": 2
    },
    {
      "t": 42.54,
      "type": "spike",
      "count": 1
    },
    {
      "t": 43.41,
      "type": "spike",
      "count": 1
    },
    {
      "t": 44.28,
      "type": "spike",
      "count": 2
    },
    {
      "t": 45.15,
      "type": "overhead",
      "gap": 58
    },
    {
      "t": 45.93,
      "type": "spike",
      "count": 3
    },
    {
      "t": 46.37,
      "type": "spike",
      "count": 2
    },
    {
      "t": 47.11,
      "type": "spike",
      "count": 3
    },
    {
      "t": 48.13,
      "type": "block"
    },
    {
      "t": 49.15,
      "type": "crumble",
      "span": 1.18,
      "delay": 0.52
    },
    {
      "t": 50.02,
      "type": "spike",
      "count": 1
    },
    {
      "t": 50.88,
      "type": "gate",
      "period": 1.4,
      "open": 0.62,
      "phase": 0.57
    },
    {
      "t": 51.9,
      "type": "overhead",
      "gap": 58
    },
    {
      "t": 52.76,
      "type": "gate",
      "period": 1.4,
      "open": 0.62,
      "phase": 0.09
    }
  ],
  "stars": [
    {
      "t": 1.6,
      "lift": 0
    },
    {
      "t": 53.6,
      "lift": 0
    },
    {
      "t": 60.6,
      "lift": 0
    }
  ],
  "checkpoints": [
    53.8
  ]
}
