{
  "id": "level-17",
  "name": "三重机关",
  "speed": 414,
  "duration": 56.52,
  "palette": "slate",
  "obstacles": [
    {
      "t": 2.15,
      "type": "crumble",
      "span": 1.18,
      "delay": 0.52
    },
    {
      "t": 3.01,
      "type": "spike",
      "count": 4
    },
    {
      "t": 3.88,
      "type": "gate",
      "period": 1.4,
      "open": 0.62,
      "phase": -0.03
    },
    {
      "t": 4.95,
      "type": "flip",
      "span": 2.35
    },
    {
      "t": 5.78,
      "type": "spike",
      "count": 4
    },
    {
      "t": 6.6,
      "type": "spike",
      "count": 4
    },
    {
      "t": 7.15,
      "type": "spike",
      "count": 4
    },
    {
      "t": 7.97,
      "type": "flip",
      "span": 3.55
    },
    {
      "t": 9.04,
      "type": "spike",
      "count": 4
    },
    {
      "t": 9.17,
      "type": "spike",
      "anchor": "ceiling",
      "count": 1
    },
    {
      "t": 9.52,
      "type": "spike",
      "count": 4
    },
    {
      "t": 10.12,
      "type": "overhead",
      "gap": 58
    },
    {
      "t": 10.32,
      "type": "spike",
      "anchor": "ceiling",
      "count": 2
    },
    {
      "t": 10.9,
      "type": "spike",
      "count": 4
    },
    {
      "t": 12.4,
      "type": "spike",
      "count": 4
    },
    {
      "t": 13.9,
      "type": "spike",
      "count": 4
    },
    {
      "t": 14.97,
      "type": "block"
    },
    {
      "t": 16.05,
      "type": "crumble",
      "span": 1.18,
      "delay": 0.52
    },
    {
      "t": 16.92,
      "type": "spike",
      "count": 4
    },
    {
      "t": 17.78,
      "type": "gate",
      "period": 1.4,
      "open": 0.62,
      "phase": -0.21
    },
    {
      "t": 18.85,
      "type": "overhead",
      "gap": 58
    },
    {
      "t": 19.71,
      "type": "gate",
      "period": 1.4,
      "open": 0.62,
      "phase": 0.66
    },
    {
      "t": 20.69,
      "type": "overhead",
      "gap": 58
    },
    {
      "t": 21.47,
      "type": "spike",
      "count": 4
    },
    {
      "t": 22.97,
      "type": "spike",
      "count": 4
    },
    {
      "t": 24.47,
      "type": "crumble",
      "span": 1.18,
      "delay": 0.52
    },
    {
      "t": 25.34,
      "type": "spike",
      "count": 4
    },
    {
      "t": 26.2,
      "type": "overhead",
      "gap": 58
    },
    {
      "t": 27.06,
      "type": "gate",
      "period": 1.4,
      "open": 0.62,
      "phase": 0.31
    },
    {
      "t": 28.05,
      "type": "spike",
      "count": 4
    },
    {
      "t": 29.12,
      "type": "spike",
      "count": 4
    },
    {
      "t": 30.19,
      "type": "block"
    },
    {
      "t": 31.26,
      "type": "overhead",
      "gap": 58
    },
    {
      "t": 32.76,
      "type": "spike",
      "count": 2
    },
    {
      "t": 34.26,
      "type": "spike",
      "count": 2
    },
    {
      "t": 35.33,
      "type": "overhead",
      "gap": 58
    },
    {
      "t": 36.11,
      "type": "spike",
      "count": 3
    },
    {
      "t": 37.1,
      "type": "spike",
      "count": 3
    },
    {
      "t": 38.17,
      "type": "block"
    },
    {
      "t": 39.25,
      "type": "crumble",
      "span": 1.18,
      "delay": 0.52
    },
    {
      "t": 40.11,
      "type": "spike",
      "count": 1
    },
    {
      "t": 40.98,
      "type": "gate",
      "period": 1.4,
      "open": 0.62,
      "phase": 0.39
    },
    {
      "t": 41.79,
      "type": "spike",
      "count": 1
    },
    {
      "t": 42.59,
      "type": "spike",
      "count": 1
    },
    {
      "t": 44.09,
      "type": "overhead",
      "gap": 58
    },
    {
      "t": 44.95,
      "type": "gate",
      "period": 1.4,
      "open": 0.62,
      "phase": 0.62
    },
    {
      "t": 45.93,
      "type": "overhead",
      "gap": 58
    },
    {
      "t": 46.71,
      "type": "spike",
      "count": 3
    },
    {
      "t": 47.7,
      "type": "crumble",
      "span": 1.18,
      "delay": 0.52
    },
    {
      "t": 48.57,
      "type": "spike",
      "count": 1
    },
    {
      "t": 49.43,
      "type": "overhead",
      "gap": 58
    },
    {
      "t": 50.29,
      "type": "gate",
      "period": 1.4,
      "open": 0.62,
      "phase": 0.88
    },
    {
      "t": 51.28,
      "type": "spike",
      "count": 1
    },
    {
      "t": 52.35,
      "type": "spike",
      "count": 2
    },
    {
      "t": 53.85,
      "type": "spike",
      "count": 2
    },
    {
      "t": 55.35,
      "type": "block"
    }
  ],
  "stars": [
    {
      "t": 1.6,
      "lift": 0
    },
    {
      "t": 23.85,
      "lift": 0
    },
    {
      "t": 43.6,
      "lift": 0
    }
  ],
  "checkpoints": [
    13.4,
    23.8,
    53.4
  ]
}
