{
  "id": "level-7",
  "name": "坠台连跳",
  "speed": 354,
  "duration": 50.68,
  "palette": "amber",
  "obstacles": [
    {
      "t": 2.15,
      "type": "crumble",
      "span": 1.18,
      "delay": 0.52
    },
    {
      "t": 3.71,
      "type": "block"
    },
    {
      "t": 4.74,
      "type": "overhead",
      "gap": 58
    },
    {
      "t": 5.29,
      "type": "spike",
      "count": 3
    },
    {
      "t": 5.68,
      "type": "spike",
      "count": 1
    },
    {
      "t": 5.86,
      "type": "spike",
      "count": 1
    },
    {
      "t": 6.16,
      "type": "spike",
      "count": 1
    },
    {
      "t": 6.34,
      "type": "spike",
      "count": 1
    },
    {
      "t": 6.52,
      "type": "spike",
      "count": 1
    },
    {
      "t": 6.7,
      "type": "spike",
      "count": 1
    },
    {
      "t": 7,
      "type": "spike",
      "count": 1
    },
    {
      "t": 8.45,
      "type": "overhead",
      "gap": 58
    },
    {
      "t": 9,
      "type": "spike",
      "count": 3
    },
    {
      "t": 9.55,
      "type": "spike",
      "count": 3
    },
    {
      "t": 10.1,
      "type": "block"
    },
    {
      "t": 10.42,
      "type": "spike",
      "count": 1
    },
    {
      "t": 10.6,
      "type": "spike",
      "count": 1
    },
    {
      "t": 10.78,
      "type": "spike",
      "count": 1
    },
    {
      "t": 10.96,
      "type": "spike",
      "count": 1
    },
    {
      "t": 13.18,
      "type": "spike",
      "count": 1
    },
    {
      "t": 14.63,
      "type": "spike",
      "count": 3
    },
    {
      "t": 15.66,
      "type": "spike",
      "count": 3
    },
    {
      "t": 16.05,
      "type": "spike",
      "count": 1
    },
    {
      "t": 16.23,
      "type": "spike",
      "count": 1
    },
    {
      "t": 17.73,
      "type": "overhead",
      "gap": 58
    },
    {
      "t": 17.93,
      "type": "spike",
      "count": 1
    },
    {
      "t": 18.11,
      "type": "spike",
      "count": 1
    },
    {
      "t": 18.29,
      "type": "spike",
      "count": 1
    },
    {
      "t": 18.47,
      "type": "spike",
      "count": 1
    },
    {
      "t": 18.77,
      "type": "spike",
      "count": 1
    },
    {
      "t": 20.33,
      "type": "spike",
      "count": 3
    },
    {
      "t": 21.36,
      "type": "overhead",
      "gap": 58
    },
    {
      "t": 22.14,
      "type": "spike",
      "count": 3
    },
    {
      "t": 23.16,
      "type": "spike",
      "count": 3
    },
    {
      "t": 24.2,
      "type": "block"
    },
    {
      "t": 25.78,
      "type": "spike",
      "count": 1
    },
    {
      "t": 25.96,
      "type": "spike",
      "count": 1
    },
    {
      "t": 27.36,
      "type": "crumble",
      "span": 1.18,
      "delay": 0.52
    },
    {
      "t": 28.92,
      "type": "spike",
      "count": 1
    },
    {
      "t": 29.95,
      "type": "spike",
      "count": 2
    },
    {
      "t": 30.98,
      "type": "block"
    },
    {
      "t": 32.56,
      "type": "spike",
      "count": 2
    },
    {
      "t": 34.14,
      "type": "overhead",
      "gap": 58
    },
    {
      "t": 34.86,
      "type": "spike",
      "count": 2
    },
    {
      "t": 35.9,
      "type": "overhead",
      "gap": 58
    },
    {
      "t": 36.68,
      "type": "spike",
      "count": 2
    },
    {
      "t": 36.96,
      "type": "spike",
      "count": 1
    },
    {
      "t": 37.14,
      "type": "spike",
      "count": 1
    },
    {
      "t": 37.44,
      "type": "spike",
      "count": 1
    },
    {
      "t": 37.62,
      "type": "spike",
      "count": 1
    },
    {
      "t": 39.96,
      "type": "spike",
      "count": 1
    },
    {
      "t": 40.86,
      "type": "block"
    },
    {
      "t": 41.89,
      "type": "crumble",
      "span": 1.18,
      "delay": 0.52
    },
    {
      "t": 44.49,
      "type": "spike",
      "count": 2
    },
    {
      "t": 44.77,
      "type": "spike",
      "count": 1
    },
    {
      "t": 44.95,
      "type": "spike",
      "count": 1
    },
    {
      "t": 45.13,
      "type": "spike",
      "count": 1
    },
    {
      "t": 45.43,
      "type": "spike",
      "count": 1
    },
    {
      "t": 45.61,
      "type": "spike",
      "count": 1
    },
    {
      "t": 45.79,
      "type": "spike",
      "count": 1
    },
    {
      "t": 45.97,
      "type": "spike",
      "count": 1
    },
    {
      "t": 46.27,
      "type": "spike",
      "count": 1
    },
    {
      "t": 47.65,
      "type": "block"
    },
    {
      "t": 48.68,
      "type": "overhead",
      "gap": 58
    },
    {
      "t": 49.4,
      "type": "spike",
      "count": 2
    }
  ],
  "stars": [
    {
      "t": 1.25,
      "lift": 0
    },
    {
      "t": 15.05,
      "lift": 200
    },
    {
      "t": 41.53,
      "lift": 200
    }
  ],
  "checkpoints": [
    13.84,
    21,
    32,
    46.84
  ],
  "routes": [
    {
      "t": 12.2,
      "span": 4.6,
      "h": 200,
      "layer": 2,
      "reward": "star",
      "step": {
        "h": 84,
        "span": 1.55,
        "lead": 0.85
      },
      "obstacles": [
        {
          "t": 13.9,
          "type": "block"
        }
      ]
    },
    {
      "t": 39,
      "span": 4.6,
      "h": 200,
      "layer": 2,
      "reward": "safe",
      "step": {
        "h": 84,
        "span": 1.55,
        "lead": 0.85
      },
      "obstacles": []
    }
  ]
}
