{
  "id": "level-9",
  "name": "开合之间",
  "speed": 366,
  "duration": 64,
  "palette": "cyan",
  "obstacles": [
    {
      "t": 2.15,
      "type": "crumble",
      "span": 1.18,
      "delay": 0.52
    },
    {
      "t": 3.67,
      "type": "gate",
      "period": 1.4,
      "open": 0.62,
      "phase": 0.18
    },
    {
      "t": 4.69,
      "type": "overhead",
      "gap": 58
    },
    {
      "t": 5.24,
      "type": "spike",
      "count": 3
    },
    {
      "t": 5.71,
      "type": "spike",
      "count": 2
    },
    {
      "t": 6.26,
      "type": "spike",
      "count": 3
    },
    {
      "t": 7.77,
      "type": "spike",
      "count": 3
    },
    {
      "t": 9.28,
      "type": "block"
    },
    {
      "t": 10.3,
      "type": "crumble",
      "span": 1.18,
      "delay": 0.52
    },
    {
      "t": 11.82,
      "type": "gate",
      "period": 1.4,
      "open": 0.62,
      "phase": 0.03
    },
    {
      "t": 12.84,
      "type": "overhead",
      "gap": 58
    },
    {
      "t": 13.7,
      "type": "gate",
      "period": 1.4,
      "open": 0.62,
      "phase": 0.95
    },
    {
      "t": 15.2,
      "type": "spike",
      "count": 3
    },
    {
      "t": 16.7,
      "type": "spike",
      "count": 3
    },
    {
      "t": 17.72,
      "type": "block"
    },
    {
      "t": 18.74,
      "type": "overhead",
      "gap": 58
    },
    {
      "t": 19.29,
      "type": "spike",
      "count": 3
    },
    {
      "t": 20.81,
      "type": "spike",
      "count": 3
    },
    {
      "t": 22.32,
      "type": "overhead",
      "gap": 58
    },
    {
      "t": 23.1,
      "type": "spike",
      "count": 3
    },
    {
      "t": 24.29,
      "type": "spike",
      "count": 3
    },
    {
      "t": 25.31,
      "type": "block"
    },
    {
      "t": 26.33,
      "type": "crumble",
      "span": 1.18,
      "delay": 0.52
    },
    {
      "t": 27.3,
      "type": "spike",
      "count": 2
    },
    {
      "t": 28.27,
      "type": "spike",
      "count": 3
    },
    {
      "t": 29.24,
      "type": "spike",
      "count": 1
    },
    {
      "t": 30.21,
      "type": "gate",
      "period": 1.4,
      "open": 0.62,
      "phase": -0.33
    },
    {
      "t": 31.23,
      "type": "overhead",
      "gap": 58
    },
    {
      "t": 32.09,
      "type": "gate",
      "period": 1.4,
      "open": 0.62,
      "phase": 0.59
    },
    {
      "t": 33.28,
      "type": "spike",
      "count": 2
    },
    {
      "t": 34.3,
      "type": "block"
    },
    {
      "t": 35.81,
      "type": "spike",
      "count": 1
    },
    {
      "t": 37.32,
      "type": "overhead",
      "gap": 58
    },
    {
      "t": 38.04,
      "type": "spike",
      "count": 2
    },
    {
      "t": 39.06,
      "type": "overhead",
      "gap": 58
    },
    {
      "t": 39.84,
      "type": "spike",
      "count": 2
    },
    {
      "t": 40.31,
      "type": "spike",
      "count": 1
    },
    {
      "t": 41.03,
      "type": "spike",
      "count": 3
    },
    {
      "t": 41.9,
      "type": "spike",
      "count": 2
    },
    {
      "t": 42.76,
      "type": "spike",
      "count": 1
    },
    {
      "t": 44.27,
      "type": "block"
    },
    {
      "t": 45.29,
      "type": "crumble",
      "span": 1.18,
      "delay": 0.52
    },
    {
      "t": 46.81,
      "type": "gate",
      "period": 1.4,
      "open": 0.62,
      "phase": -0.13
    },
    {
      "t": 47.83,
      "type": "overhead",
      "gap": 58
    },
    {
      "t": 48.69,
      "type": "gate",
      "period": 1.4,
      "open": 0.62,
      "phase": 0.79
    }
  ],
  "stars": [
    {
      "t": 1.6,
      "lift": 0
    },
    {
      "t": 23.85,
      "lift": 0
    },
    {
      "t": 43.85,
      "lift": 0
    }
  ],
  "checkpoints": [
    14.6,
    35.4,
    49.8
  ]
}
