{
  "id": "level-5",
  "name": "夜紫疾走",
  "speed": 342,
  "duration": 56.17,
  "palette": "night",
  "obstacles": [
    {
      "t": 2.15,
      "type": "crumble",
      "span": 1.18,
      "delay": 0.52
    },
    {
      "t": 4.83,
      "type": "spike",
      "count": 3
    },
    {
      "t": 6.33,
      "type": "block"
    },
    {
      "t": 7.83,
      "type": "spike",
      "count": 3
    },
    {
      "t": 9.33,
      "type": "spike",
      "count": 3
    },
    {
      "t": 9.73,
      "type": "spike",
      "count": 1
    },
    {
      "t": 9.92,
      "type": "spike",
      "count": 1
    },
    {
      "t": 10.23,
      "type": "spike",
      "count": 1
    },
    {
      "t": 10.42,
      "type": "spike",
      "count": 1
    },
    {
      "t": 10.61,
      "type": "spike",
      "count": 1
    },
    {
      "t": 10.8,
      "type": "spike",
      "count": 1
    },
    {
      "t": 13.15,
      "type": "spike",
      "count": 1
    },
    {
      "t": 14.13,
      "type": "overhead",
      "gap": 58
    },
    {
      "t": 14.68,
      "type": "spike",
      "count": 3
    },
    {
      "t": 16.18,
      "type": "overhead",
      "gap": 58
    },
    {
      "t": 16.38,
      "type": "spike",
      "count": 1
    },
    {
      "t": 17.65,
      "type": "spike",
      "count": 1
    },
    {
      "t": 17.84,
      "type": "spike",
      "count": 1
    },
    {
      "t": 19.93,
      "type": "spike",
      "count": 3
    },
    {
      "t": 21.43,
      "type": "block"
    },
    {
      "t": 22.93,
      "type": "spike",
      "count": 3
    },
    {
      "t": 24.43,
      "type": "spike",
      "count": 3
    },
    {
      "t": 24.83,
      "type": "spike",
      "count": 1
    },
    {
      "t": 25.02,
      "type": "spike",
      "count": 1
    },
    {
      "t": 25.33,
      "type": "spike",
      "count": 1
    },
    {
      "t": 25.52,
      "type": "spike",
      "count": 1
    },
    {
      "t": 27.74,
      "type": "block"
    },
    {
      "t": 29.24,
      "type": "overhead",
      "gap": 58
    },
    {
      "t": 29.79,
      "type": "spike",
      "count": 3
    },
    {
      "t": 31.29,
      "type": "overhead",
      "gap": 58
    },
    {
      "t": 32.07,
      "type": "spike",
      "count": 2
    },
    {
      "t": 32.36,
      "type": "spike",
      "count": 1
    },
    {
      "t": 32.55,
      "type": "spike",
      "count": 1
    },
    {
      "t": 32.86,
      "type": "spike",
      "count": 1
    },
    {
      "t": 33.05,
      "type": "spike",
      "count": 1
    },
    {
      "t": 35.28,
      "type": "spike",
      "count": 3
    },
    {
      "t": 36.78,
      "type": "block"
    },
    {
      "t": 38.28,
      "type": "spike",
      "count": 1
    },
    {
      "t": 39.78,
      "type": "spike",
      "count": 2
    },
    {
      "t": 40.07,
      "type": "spike",
      "count": 1
    },
    {
      "t": 40.26,
      "type": "spike",
      "count": 1
    },
    {
      "t": 40.57,
      "type": "spike",
      "count": 1
    },
    {
      "t": 40.76,
      "type": "spike",
      "count": 1
    },
    {
      "t": 40.95,
      "type": "spike",
      "count": 1
    },
    {
      "t": 43.09,
      "type": "block"
    },
    {
      "t": 43.29,
      "type": "spike",
      "count": 1
    },
    {
      "t": 45.52,
      "type": "spike",
      "count": 1
    },
    {
      "t": 46.4,
      "type": "overhead",
      "gap": 58
    },
    {
      "t": 47.18,
      "type": "spike",
      "count": 2
    },
    {
      "t": 47.47,
      "type": "spike",
      "count": 1
    },
    {
      "t": 47.66,
      "type": "spike",
      "count": 1
    },
    {
      "t": 47.97,
      "type": "spike",
      "count": 1
    },
    {
      "t": 48.16,
      "type": "spike",
      "count": 1
    },
    {
      "t": 50.39,
      "type": "spike",
      "count": 3
    },
    {
      "t": 51.89,
      "type": "block"
    },
    {
      "t": 53.39,
      "type": "spike",
      "count": 1
    },
    {
      "t": 54.89,
      "type": "spike",
      "count": 2
    }
  ],
  "stars": [
    {
      "t": 1.25,
      "lift": 0
    },
    {
      "t": 15.05,
      "lift": 200
    },
    {
      "t": 34.83,
      "lift": 0
    }
  ],
  "powerups": [
    { "t": 26.683, "type": "armor" },
    { "t": 49.327, "type": "plane" }
  ],
  "checkpoints": [
    13.84,
    21,
    33.6,
    46.84
  ],
  "routes": [
    {
      "t": 12.2,
      "span": 4.6,
      "h": 200,
      "layer": 2,
      "reward": "star",
      "step": {
        "h": 84,
        "span": 1.55,
        "lead": 0.85
      },
      "obstacles": [
        {
          "t": 13.9,
          "type": "block"
        }
      ]
    },
    {
      "t": 44.6,
      "span": 4.6,
      "h": 200,
      "layer": 2,
      "reward": "safe",
      "step": {
        "h": 84,
        "span": 1.55,
        "lead": 0.85
      },
      "obstacles": []
    }
  ]
}
